{
  "$schema": "./map.schema.json",
  "schemaVersion": 1,
  "id": "matrix-multiplication",
  "title": "Matrix multiplication",
  "description": "A progressive concept map and textbook, from single-entry products to rectangular products, special matrices, and deeper connections.",
  "startNode": "one",
  "readingOrder": [
    "one",
    "dot",
    "shapes",
    "vector",
    "rectangle",
    "order",
    "identity",
    "diagonal",
    "permutation",
    "geometry",
    "transpose",
    "inverse",
    "laws",
    "outer"
  ],
  "categories": [
    {
      "id": "the-rule",
      "title": "The rule",
      "description": "Understand row-by-column multiplication and when a product exists.",
      "order": 1,
      "layout": {
        "x": 18,
        "y": 9
      }
    },
    {
      "id": "building-the-product",
      "title": "Building the product",
      "description": "Build matrix-vector and rectangular products, then examine why multiplication order matters.",
      "order": 2,
      "layout": {
        "x": 18,
        "y": 276
      }
    },
    {
      "id": "special-matrices",
      "title": "Special matrices",
      "description": "Explore matrices that preserve, zero, scale, or rearrange data.",
      "order": 3,
      "layout": {
        "x": 18,
        "y": 548
      }
    },
    {
      "id": "connections",
      "title": "Connections",
      "description": "Connect multiplication to geometry, transposes, inverses, algebraic laws, and outer products.",
      "order": 4,
      "layout": {
        "x": 18,
        "y": 753
      }
    }
  ],
  "nodes": [
    {
      "id": "one",
      "title": "One number at a time",
      "shortTitle": "1 × 1",
      "categoryId": "the-rule",
      "summary": "A matrix is a rectangular array of numbers. Its shape is written rows × columns. A 1 × 1 matrix has just one entry, so multiplying two of them is ordinary multiplication in brackets.",
      "content": "lessons/one.md",
      "example": {
        "operation": "matrix-multiplication",
        "A": [
          [
            3
          ]
        ],
        "B": [
          [
            4
          ]
        ],
        "expectedProduct": [
          [
            12
          ]
        ]
      },
      "presets": [],
      "checkpoint": {
        "id": "one-checkpoint",
        "type": "numeric",
        "prompt": "What is the only entry of [−2][5]?",
        "answer": -10,
        "tolerance": 1e-9,
        "hint": "Multiply the two entries. A negative times a positive is negative.",
        "explanation": "(−2) × 5 = −10, so the product is [−10]."
      },
      "interactions": [
        "edit-matrices",
        "trace-dot-product"
      ],
      "layout": {
        "x": 135,
        "y": 52
      }
    },
    {
      "id": "dot",
      "title": "A row meets a column",
      "shortTitle": "Dot product",
      "categoryId": "the-rule",
      "summary": "Multiply matching entries, then add the products. This row-by-column calculation is a dot product: it is the single operation behind every entry of a matrix product.",
      "content": "lessons/dot.md",
      "example": {
        "operation": "matrix-multiplication",
        "A": [
          [
            2,
            3,
            -1
          ]
        ],
        "B": [
          [
            4
          ],
          [
            1
          ],
          [
            2
          ]
        ],
        "expectedProduct": [
          [
            9
          ]
        ]
      },
      "presets": [],
      "checkpoint": {
        "id": "dot-checkpoint",
        "type": "numeric",
        "prompt": "Compute [1  −2  3] [4  5  2]ᵀ. What is the result's single entry?",
        "answer": 0,
        "tolerance": 1e-9,
        "hint": "The three terms are 4, −10, and 6.",
        "explanation": "1·4 + (−2)·5 + 3·2 = 4 − 10 + 6 = 0. Nonzero vectors can have zero dot product."
      },
      "interactions": [
        "edit-matrices",
        "trace-dot-product"
      ],
      "layout": {
        "x": 135,
        "y": 137
      }
    },
    {
      "id": "shapes",
      "title": "When a product exists",
      "shortTitle": "Shapes",
      "categoryId": "the-rule",
      "summary": "A row of A must have exactly as many entries as a column of B. That is why A's column count must match B's row count.",
      "content": "lessons/shapes.md",
      "example": {
        "operation": "matrix-multiplication",
        "A": [
          [
            1,
            2,
            3
          ],
          [
            4,
            5,
            6
          ]
        ],
        "B": [
          [
            1,
            0
          ],
          [
            0,
            1
          ],
          [
            1,
            1
          ]
        ],
        "expectedProduct": [
          [
            4,
            5
          ],
          [
            10,
            11
          ]
        ]
      },
      "presets": [
        {
          "id": "small",
          "title": "2 × 3 by 3 × 2",
          "operation": "matrix-multiplication",
          "A": [
            [
              1,
              2,
              3
            ],
            [
              0,
              -1,
              2
            ]
          ],
          "B": [
            [
              1,
              2
            ],
            [
              0,
              1
            ],
            [
              3,
              0
            ]
          ],
          "expectedProduct": [
            [
              10,
              4
            ],
            [
              6,
              -1
            ]
          ]
        },
        {
          "id": "large",
          "title": "3 × 2 by 2 × 4",
          "operation": "matrix-multiplication",
          "A": [
            [
              1,
              2
            ],
            [
              0,
              -1
            ],
            [
              3,
              1
            ]
          ],
          "B": [
            [
              1,
              0,
              2,
              -1
            ],
            [
              3,
              1,
              0,
              2
            ]
          ],
          "expectedProduct": [
            [
              7,
              2,
              2,
              3
            ],
            [
              -3,
              -1,
              0,
              -2
            ],
            [
              6,
              1,
              6,
              -1
            ]
          ]
        },
        {
          "id": "invalid",
          "title": "Incompatible inner dimensions",
          "operation": "matrix-multiplication",
          "A": [
            [
              1,
              2,
              3
            ],
            [
              4,
              5,
              6
            ]
          ],
          "B": [
            [
              1,
              0
            ],
            [
              0,
              1
            ]
          ],
          "expectedProduct": null
        }
      ],
      "checkpoint": {
        "id": "shapes-checkpoint",
        "type": "single-choice",
        "prompt": "A has shape 3 × 2 and B has shape 2 × 4. What is the shape of AB?",
        "options": [
          "3 × 4",
          "2 × 2",
          "4 × 3",
          "Undefined"
        ],
        "answer": "3 × 4",
        "hint": "Match the two inner dimensions, then keep the outside pair.",
        "explanation": "(3 × 2)(2 × 4) → 3 × 4. There is one output for each of A's three rows and B's four columns."
      },
      "interactions": [
        "edit-matrices",
        "trace-dot-product",
        "resize-matrices"
      ],
      "layout": {
        "x": 135,
        "y": 222
      }
    },
    {
      "id": "vector",
      "title": "A matrix acts on a vector",
      "shortTitle": "Matrix × vector",
      "categoryId": "building-the-product",
      "summary": "A column vector is a matrix with one column. Multiplying A by a vector computes one dot product for every row of A.",
      "content": "lessons/vector.md",
      "example": {
        "operation": "matrix-multiplication",
        "A": [
          [
            1,
            2
          ],
          [
            3,
            1
          ]
        ],
        "B": [
          [
            2
          ],
          [
            1
          ]
        ],
        "expectedProduct": [
          [
            4
          ],
          [
            7
          ]
        ]
      },
      "presets": [],
      "checkpoint": {
        "id": "vector-checkpoint",
        "type": "single-choice",
        "prompt": "For A = [[1, 2], [3, 1]] and x = [0, 1]ᵀ, what is Ax?",
        "options": [
          "[2, 1]ᵀ",
          "[1, 3]ᵀ",
          "[0, 1]ᵀ",
          "[3, 3]ᵀ"
        ],
        "answer": "[2, 1]ᵀ",
        "hint": "The weights are 0 and 1, so only the second column survives.",
        "explanation": "Ax = 0·[1, 3]ᵀ + 1·[2, 1]ᵀ = [2, 1]ᵀ."
      },
      "interactions": [
        "edit-matrices",
        "trace-dot-product",
        "coordinate-view"
      ],
      "layout": {
        "x": 135,
        "y": 326
      }
    },
    {
      "id": "rectangle",
      "title": "Every output is a dot product",
      "shortTitle": "Rectangular products",
      "categoryId": "building-the-product",
      "summary": "For AB, entry (i, j) is row i of A dotted with column j of B. Repeat this rule for each output position. Here we number rows and columns starting at 1.",
      "content": "lessons/rectangle.md",
      "example": {
        "operation": "matrix-multiplication",
        "A": [
          [
            1,
            2,
            3
          ],
          [
            0,
            -1,
            2
          ]
        ],
        "B": [
          [
            1,
            2
          ],
          [
            0,
            1
          ],
          [
            3,
            0
          ]